pfam_number	Name	Description	Long_description	enzyme_annotation
PF02137	A_deamin	Adenosine-deaminase (editase) domain	Adenosine deaminases acting on RNA (ADARs) can deaminate adenosine to form inosine. In long double-stranded RNA, this process is non-specific; it occurs site-specifically in RNA transcripts. The former is important in defence against viruses, whereas the latter may affect splicing or untranslated regions. They are primarily nuclear proteins, but a longer isoform of ADAR1 is found predominantly in the cytoplasm. ADARs are derived from the Tad1-like tRNA deaminases that are present across eukaryotes. These in turn belong to the nucleotide/nucleic acid deaminase superfamily and  are characterized by a distinct insert between the two conserved cysteines that are involved in binding zinc [2].	m
PF02146	SIR2	Sir2 family	This region is characteristic of Silent information regulator 2 (Sir2) proteins, or sirtuins. These are protein deacetylases that depend on nicotine adenine dinucleotide (NAD). They are found in many subcellular locations, including the nucleus, cytoplasm and mitochondria. Eukaryotic forms play in important role in the regulation of transcriptional repression. Moreover, they are involved in microtubule organisation and DNA damage repair processes [1].i	m
PF02152	FolB	Dihydroneopterin aldolase	This enzyme EC:4.1.2.25 catalyses the conversion of 7,8-dihydroneopterin to 6-hydroxymethyl-7,8-dihydropterin in the biosynthetic pathway of tetrahydrofolate.	y
PF02153	PDH	Prephenate dehydrogenase	Members of this family are prephenate dehydrogenases EC:1.3.1.12 involved in tyrosine biosynthesis.	y
PF02156	Glyco_hydro_26	Glycosyl hydrolase family 26		s
PF02163	Peptidase_M50	Peptidase family M50		m
PF02171	Piwi	Piwi domain	This domain is found in the protein Piwi and its relatives.  The function of this domain is the dsRNA guided hydrolysis of ssRNA. Determination of the crystal structure of Argonaute reveals that PIWI is an RNase H domain, and identifies Argonaute as Slicer, the enzyme that cleaves mRNA in the RNAi RISC complex [2].  In addition, Mg+2 dependence and production of 3'-OH and 5' phosphate products are shared characteristics of RNaseH and RISC. The PIWI domain core has a tertiary structure belonging to the RNase H family of enzymes.  RNase H fold proteins all have a five-stranded mixed beta-sheet surrounded by helices. By analogy to RNase H enzymes which cleave single-stranded RNA guided by the DNA strand in an RNA/DNA hybrid, the PIWI domain can be inferred to cleave single-stranded RNA, for example mRNA, guided by double stranded siRNA.	y
PF02195	ParBc	ParB-like nuclease domain		m
PF02211	NHase_beta	Nitrile hydratase beta subunit	Nitrile hydratases EC:4.2.1.84 are unusual metalloenzymes that catalyse the hydration of nitriles to their corresponding amides. They are used as biocatalysts in acrylamide production, one of the few commercial scale bioprocesses, as well as in environmental remediation for the removal of nitriles from waste streams. Nitrile hydratases are composed of two subunits, alpha and beta, and they contain one iron atom per alpha beta unit [1]. 	y
PF02219	MTHFR	Methylenetetrahydrofolate reductase	This family includes the 5,10-methylenetetrahydrofolate reductase EC:1.7.99.5 from bacteria and  methylenetetrahydrofolate reductase EC: 1.5.1.20 from eukaryotes. The structure for this domain is known [1] to be a TIM barrel.	y
PF02222	ATP-grasp	ATP-grasp domain	This family does not contain all known ATP-grasp domain members. This family includes a diverse set of enzymes that possess ATP-dependent carboxylate-amine ligase activity.	y
PF02223	Thymidylate_kin	Thymidylate kinase		y
PF02230	Abhydrolase_2	Phospholipase/Carboxylesterase	This family consists of both phospholipases [1] and carboxylesterases with broad substrate specificity, and is structurally related to  alpha/beta hydrolases Pfam:PF00561 [2].	y
PF02233	PNTB	NAD(P) transhydrogenase beta subunit	This family corresponds to the beta subunit of NADP transhydrogenase in prokaryotes, and either the protein N- or C terminal in eukaryotes.  The domain is often found in conjunction with Pfam:PF01262. Pyridine  nucleotide transhydrogenase catalyses the reduction of NAD+ to NADPH. A complete loss of activity occurs upon  mutation of Gly314 in  E. coli [1].	y
PF02238	COX7a	Cytochrome c oxidase subunit VII	Cytochrome c oxidase, a 13 sub-unit complex, is the terminal oxidase in the mitochondrial electron transport chain. This family also contains both heart and liver isoforms of cytochrome c oxidase subunit VIIa.	e
PF02240	MCR_gamma	Methyl-coenzyme M reductase gamma subunit	Methyl-coenzyme M reductase (MCR) is the enzyme responsible for  microbial formation of methane. It is a hexamer composed of 2 alpha (Pfam:PF02249), 2 beta (Pfam:PF02241), and 2 gamma (this family)  subunits with two identical nickel porphinoid active sites [1].	y
PF02241	MCR_beta	Methyl-coenzyme M reductase beta subunit, C-terminal domain	Methyl-coenzyme M reductase (MCR) is the enzyme responsible for microbial formation of methane. It is a hexamer composed of 2 alpha (Pfam:PF02249), 2 beta (this family), and 2 gamma (Pfam:PF02240) subunits with two identical nickel porphinoid active sites [1]. The C-terminal domain of MCR beta has an all-alpha fold with buried central helix.	y
PF02245	Pur_DNA_glyco	Methylpurine-DNA glycosylase (MPG)	Methylpurine-DNA glycosylase is a base excision-repair protein. It is responsible for the hydrolysis of the deoxyribose N-glycosidic bond, excising 3-methyladenine and 3-methylguanine from damaged DNA.	m
PF02249	MCR_alpha	Methyl-coenzyme M reductase alpha subunit, C-terminal domain	Methyl-coenzyme M reductase (MCR) is the enzyme responsible for  microbial formation of methane. It is a hexamer composed of 2 alpha (this family), 2 beta (Pfam:PF02241), and 2 gamma (Pfam:PF02240) subunits with two identical nickel porphinoid active sites [1]. The C-terminal domain is comprised of an all-alpha multi-helical bundle.	y
PF02254	TrkA_N	TrkA-N domain	This domain is found in a wide variety of proteins. These protein include potassium channels Swiss:P31069, phosphoesterases Swiss:Q59027, and various other transporters.  This domain binds to NAD.	u
PF02261	Asp_decarbox	Aspartate decarboxylase	Decarboxylation of aspartate is the major route of beta-alanine  production in bacteria, and is catalysed by the enzyme aspartate decarboxylase EC:4.1.1.11 which requires a pyruvoyl group for its activity. It is synthesised initially as a proenzyme which is then proteolytically cleaved to an alpha (C-terminal) and beta (N-terminal) subunit and a pyruvoyl group. This family contains both chains of aspartate decarboxylase.	y
PF02263	GBP	Guanylate-binding protein, N-terminal domain	Transcription of the anti-viral guanylate-binding protein (GBP) is induced by interferon-gamma during macrophage induction. This family contains GBP1 and GPB2, both GTPases capable of binding GTP, GDP and GMP.	m
PF02265	S1-P1_nuclease	S1/P1 Nuclease	This family contains both S1 and P1 nucleases (EC:3.1.30.1) which cleave RNA and single stranded DNA with no base specificity.	m
PF02267	Rib_hydrolayse	ADP-ribosyl cyclase	ADP-ribosyl cyclase EC:3.2.2.5 (also know as cyclic ADP-ribose  hydrolase or CD38) synthesises cyclic-ADP ribose, a second messenger for glucose-induced insulin secretion.	y
PF02271	UCR_14kD	Ubiquinol-cytochrome C reductase complex 14kD subunit	The ubiquinol-cytochrome C reductase complex (cytochrome bc1 complex) is a respiratory multienzyme complex [1]. This Pfam family represents the 14kD (or VI) subunit of the complex which is not directly involved in electron transfer, but has a role in assembly of the complex [2].	e
PF02273	Acyl_transf_2	Acyl transferase	This bacterial family of Acyl transferases (or myristoyl-acp-specific thioesterases) catalyse the first step in the bioluminescent fatty acid reductase system.	y
PF02275	CBAH	Linear amide C-N hydrolases, choloylglycine hydrolase family	This family includes several hydrolases which cleave carbon-nitrogen bonds, other than peptide bonds, in linear amides.  These include choloylglycine hydrolase (conjugated bile acid hydrolase, CBAH) EC:3.5.1.24, penicillin acylase EC:3.5.1.11 and acid ceramidase EC:3.5.1.23. This domain forms the alpha-subunit for members from vertebral species, see family NAAA-beta, Pfam:PF15508.	y
PF02277	DBI_PRT	Phosphoribosyltransferase	This family of proteins represent the nicotinate-nucleotide- dimethylbenzimidazole phosphoribosyltransferase (NN:DBI PRT) enzymes involved in dimethylbenzimidazole synthesis. This function is essential to de novo cobalamin (vitamin B12) production in bacteria. Nicotinate mononucleotide (NaMN):5,6-dimethylbenzimidazole (DMB) phosphoribosyltransferase (CobT) from Salmonella enterica plays a central role in the synthesis of alpha-ribazole-5'-phosphate, an intermediate for the lower ligand of cobalamin [2].	y
PF02283	CobU	Cobinamide kinase / cobinamide phosphate guanyltransferase	This family is composed of a group of bifunctional cobalamin  biosynthesis enzymes which display cobinamide kinase and cobinamide phosphate guanyltransferase activity. The crystal structure of the enzyme reveals the molecule to be a trimer with a propeller-like shape [1].	y
PF02284	COX5A	Cytochrome c oxidase subunit Va	Cytochrome c oxidase, a 13 sub-unit complex, EC:1.9.3.1 is the terminal oxidase in the mitochondrial electron transport chain. This family is composed of cytochrome c oxidase subunit Va.	e
PF02285	COX8	Cytochrome oxidase c subunit VIII	Cytochrome c oxidase, a 13 sub-unit complex, EC:1.9.3.1 is the terminal oxidase in the mitochondrial electron transport chain. This family is composed of cytochrome c oxidase subunit VIII.	e
PF02286	Dehydratase_LU	Dehydratase large subunit	This family contains the large subunit of the trimeric diol dehydratases and glycerol dehydratases. These enzymes are produced by some enterobacteria in response to growth substances.	y
PF02287	Dehydratase_SU	Dehydratase small subunit	This family contains the small subunit of the trimeric diol dehydratases and glycerol dehydratases. These enzymes are produced by some enterobacteria in response to growth substances.	y
PF02288	Dehydratase_MU	Dehydratase medium subunit	This family contains the medium subunit of the trimeric diol dehydratases and glycerol dehydratases. These enzymes are produced by some enterobacteria in response to growth substances.	y
PF02289	MCH	Cyclohydrolase (MCH)	Methenyl tetrahydromethanopterin cyclohydrolase EC:3.5.4.27 is involved in methanogenesis in bacteria and archaea, producing methane from  carbon monoxide or carbon dioxide.	y
PF02297	COX6B	Cytochrome oxidase c subunit VIb	Cytochrome c oxidase, a 13 sub-unit complex, EC:1.9.3.1 is the terminal oxidase in the mitochondrial electron transport chain. This family is composed of the potentially heme-binding subunit IVb of the oxidase.	e
PF02300	Fumarate_red_C	Fumarate reductase subunit C	Fumarate reductase is a membrane-bound flavoenzyme consisting of  four subunits, A-B. A and B comprise the membrane-extrinsic catalytic domain and C and D link the catalytic centres to the electron-transport chain. This family consists of the 15kD hydrophobic subunit C.	e
PF02313	Fumarate_red_D	Fumarate reductase subunit D	Fumarate reductase is a membrane-bound flavoenzyme consisting of  four subunits, A-B. A and B comprise the membrane-extrinsic catalytic domain and C and D link the catalytic centres to the electron-transport chain. This family consists of the 13kD hydrophobic subunit D.	e
PF02315	MDH	Methanol dehydrogenase beta subunit	Methanol dehydrogenase (MDH) is a bacterial periplasmic quinoprotein that oxidises methanol to formaldehyde. MDH is a tetramer of two alpha and two beta subunits. This family contains the small beta subunit.	y
PF02317	Octopine_DH	NAD/NADP octopine/nopaline dehydrogenase, alpha-helical domain	This group of enzymes act on the CH-NH substrate bond using NAD(+) or NADP(+) as an acceptor. The Pfam family consists mainly of octopine and nopaline dehydrogenases from Ti plasmids.	y
PF02324	Glyco_hydro_70	Glycosyl hydrolase family 70	Members of this family belong to glycosyl hydrolase family 70 [1] Glucosyltransferases or sucrose 6-glycosyl transferases (GTF-S) catalyse the transfer of D-glucopyramnosyl units from sucrose  onto acceptor molecules [2], EC:2.4.1.5.  This family roughly corresponds to the N-terminal catalytic domain of the enzyme. Members of this family also contain the Putative cell wall binding domain Pfam:PF01473, which corresponds with the C-terminal glucan-binding domain.	s
PF02329	HDC	Histidine carboxylase PI chain	Histidine carboxylase catalyses the formation of histamine from histidine. Cleavage of the proenzyme PI chain yields two subunits,  alpha and beta, which arrange as a hexamer (alpha beta)6. 	y
PF02332	Phenol_Hydrox	Methane/Phenol/Toluene Hydroxylase	Bacterial phenol hydroxylase is a multicomponent enzyme that catabolises phenol and some of its methylated derivatives. This Pfam family contains both the P1 and P3 polypeptides of phenol hydroxylase and the alpha and beta chain of methane hydroxylase protein A.	y
PF02333	Phytase	Phytase	Phytase is a secreted enzyme which hydrolyses phytate to release inorganic phosphate. This family appears to represent a novel enzyme that shows phytase activity [1] and has been shown to have a six- bladed propeller folding architecture [2].	y
PF02338	OTU	OTU-like cysteine protease	This family is comprised of a group of predicted cysteine proteases, homologous to the Ovarian Tumour (OTU) gene in Drosophila. Members include proteins from eukaryotes, viruses and pathogenic bacterium. The conserved cysteine and histidine, and possibly the aspartate, represent the catalytic residues in this putative group of proteases.	m
PF02347	GDC-P	Glycine cleavage system P-protein	This family consists of Glycine cleavage system P-proteins EC:1.4.4.2 from bacterial, mammalian and plant sources.  The P protein is part of the glycine decarboxylase multienzyme complex EC:2.1.2.10 (GDC)  also annotated as glycine cleavage system or glycine synthase. GDC consists of four proteins P, H, L and T [2].  The reaction catalysed by this protein is:-  Glycine + lipoylprotein <=> S-aminomethyldihydrolipoylprotein + CO2	y
PF02348	CTP_transf_3	Cytidylyltransferase	This family consists of two main Cytidylyltransferase activities: 1) 3-deoxy-manno-octulosonate cytidylyltransferase, [3], EC:2.7.7.38 catalysing the reaction:- CTP + 3-deoxy-D-manno-octulosonate <=> diphosphate + CMP-3-deoxy-D-manno-octulosonate, 2) acylneuraminate cytidylyltransferase EC:2.7.7.43, [1,2], catalysing  the reaction:- CTP + N-acylneuraminate <=> diphosphate + CMP-N-acylneuraminate. NeuAc cytydilyltransferase of Mannheimia haemolytica has been characterised describing kinetics and regulation by substrate charge, energetic charge and amino-sugar demand[4].	y
PF02350	Epimerase_2	UDP-N-acetylglucosamine 2-epimerase	This family consists of UDP-N-acetylglucosamine 2-epimerases EC:5.1.3.14 this enzyme catalyses the production of UDP-ManNAc from UDP-GlcNAc.  Note that some of the enzymes is this family are bifunctional such as Swiss:O35826 and Swiss:Q9Z0P6 in this instance Pfam matches only the N-terminal half of the protein suggesting that the additional C-terminal part (when compared to mono-functional members of this family) is responsible for the UPD-N-acetylmannosamine kinase activity of these enzymes. This hypothesis is further supported by the assumption that the C-terminal part of Swiss:O35826 is the kinase domain [3].	y
PF02358	Trehalose_PPase	Trehalose-phosphatase	This family consist of trehalose-phosphatases EC:3.1.3.12 these enzyme catalyse the de-phosphorylation of trehalose-6-phosphate to trehalose and orthophosphate.  The aligned region is present in  trehalose-phosphatases and comprises the entire length of the protein it is also found in the C-terminus of trehalose-6-phosphate synthase  EC:2.4.1.15 adjacent to the trehalose-6-phosphate synthase domain - Pfam:PF00982.  It would appear that the two equivalent genes in the  E. coli otsBA operon [2] otsA the trehalose-6-phosphate synthase and otsB trehalose-phosphatase (this family) have undergone gene fusion in most eukaryotes e.g. Swiss:P31688 and Swiss:P93653. Trehalose is a common disaccharide of bacteria, fungi and invertebrates that appears to play a major role in desiccation tolerance [1].	y
PF02364	Glucan_synthase	1,3-beta-glucan synthase component 	This family consists of various 1,3-beta-glucan synthase components including Gls1, Gls2 and Gls3 from yeast. 1,3-beta-glucan synthase EC:2.4.1.34 also known as callose synthase catalyses the formation of a beta-1,3-glucan polymer that is a major component of the fungal cell wall [1]. The reaction catalysed is:- UDP-glucose + {(1,3)-beta-D-glucosyl}(N) <=> UDP + {(1,3)-beta-D-glucosyl}(N+1).	s
PF02366	PMT	Dolichyl-phosphate-mannose-protein mannosyltransferase  	This is a family of Dolichyl-phosphate-mannose-protein mannosyltransferase proteins EC:2.4.1.109.  These proteins are responsible for O-linked glycosylation of proteins, they catalyse the reaction:- Dolichyl phosphate D-mannose + protein <=> dolichyl phosphate + O-D-mannosyl-protein.  Also in this family is Swiss:Q94891 Drosophila rotated abdomen protein which is a putative mannosyltransferase [2]. This family appears to be distantly related to Pfam:PF02516 (A Bateman pers. obs.). This family also contains sequences from ArnTs (4-amino-4-deoxy-L-arabinose lipid A transferase). They catalyse the addition of 4-amino-4-deoxy-l-arabinose (l-Ara4N) to the lipid A moiety of the lipopolysaccharide [4]. This is a critical modification enabling bacteria (e.g. Escherichia coliandSalmonella typhimurium) to resist killing by antimicrobial peptides such as polymyxins [5]. Members such as Swiss:O52327 are predicted to have 12 trans-membrane regions. The N-terminal portion of these proteins is hypothesised to have a conserved glycosylation activity which is shared between distantly related oligosaccharyltransferases ArnT and PglB families [4].	y
PF02371	Transposase_20	Transposase IS116/IS110/IS902 family	Transposases are needed for efficient transposition of the insertion sequence or transposon DNA. This family includes transposases for IS116, IS110 and IS902. This region is often found with Pfam:PF01548. The exact function of this region is uncertain. This family contains a HHH motif suggesting a DNA-binding function.	y
PF02373	JmjC	JmjC domain, hydroxylase	The JmjC domain belongs to the Cupin superfamily [3]. JmjC-domain proteins may be protein hydroxylases that catalyse a novel histone modification [4]. This is confirmed to be a hydroxylase: the human JmjC protein named Tyw5p unexpectedly acts in the biosynthesis of a hypermodified nucleoside, hydroxy-wybutosine, in tRNA-Phe by catalysing hydroxylation [5].	y
PF02384	N6_Mtase	N-6 DNA Methylase	Restriction-modification (R-M) systems protect a bacterial  cell against invasion of foreign DNA by endonucleolytic  cleavage of DNA that lacks a site specific modification. The R-M system is a complex containing three polypeptides: M (this family), S (Pfam:PF01420), and R [4]. This family consists of N-6 adenine-specific DNA methylase EC:2.1.1.72 from Type I and Type IC restriction systems. These methylases have the same sequence specificity as their corresponding restriction enzymes.	m
PF02388	FemAB	FemAB family	The femAB operon codes for two nearly identical approximately 50-kDa proteins involved in the formation of the Staphylococcal pentaglycine interpeptide bridge in peptidoglycan [1]. These proteins are also considered as a factor influencing the level of methicillin resistance [2].	s
PF02390	Methyltransf_4	Putative methyltransferase 	This is a family of putative methyltransferases. The aligned  region contains the GXGXG S-AdoMet binding site suggesting  a putative methyltransferase activity.	y
PF02391	MoaE	MoaE protein	This family contains the MoaE protein that is involved in biosynthesis of molybdopterin [1]. Molybdopterin, the universal component of the pterin molybdenum cofactors, contains a dithiolene group serving to bind Mo. Addition of the dithiolene sulfurs to a molybdopterin precursor requires the activity of the converting factor. Converting factor contains the MoaE and MoaD proteins.	y
PF02395	Peptidase_S6	Immunoglobulin A1 protease	This family consists of immunoglobulin A1 protease proteins.  The immunoglobulin A1 protease cleaves immunoglobulin IgA and is found in pathogenic bacteria such as Neisseria gonorrhoeae [3]. Not all of the members of this family are IgA proteases Swiss:O32555 from E. coli O157:H7 cleaves human coagulation factor V [2] and Swiss:O88093 is a hemoglobin protease from E. coli EB1 [1].	y
PF02397	Bac_transf	Bacterial sugar transferase	This Pfam family represents a conserved region from a number of  different bacterial sugar transferases, involved in diverse  biosynthesis pathways.	y
PF02423	OCD_Mu_crystall	Ornithine cyclodeaminase/mu-crystallin family	This family contains the bacterial Ornithine cyclodeaminase enzyme EC:4.3.1.12, which catalyses the deamination of ornithine to proline [1]. This family also contains mu-Crystallin the major component of the eye lens in several Australian marsupials, mRNA for this protein has also been found in human retina [2].	y
PF02424	ApbE	ApbE family	This prokaryotic family of lipoproteins are related to ApbE from Salmonella typhimurium. ApbE is involved in thiamine synthesis [1].  It acts as an FAD:protein FMN-transferase, catalysing the attachment of an FMN residue to a threonine residue of a protein via a phosphoester bond in such bacterial flavoproteins [4].	y
PF02426	MIase	Muconolactone delta-isomerase	This small enzyme forms a homodecameric complex, that catalyses the third step in the catabolism of catechol to succinate- and acetyl-coa in the beta-ketoadipate pathway EC:5.3.3.4. The protein has a ferredoxin-like fold according to SCOP.	y
PF02431	Chalcone	Chalcone-flavanone isomerase	Chalcone-flavanone isomerase is a plant enzyme responsible for the isomerisation of chalcone to naringenin, 4',5,7-trihydroxyflavanone, a key step in the biosynthesis of flavonoids.	y
PF02433	FixO	Cytochrome C oxidase, mono-heme subunit/FixO	The bacterial oxidase complex, fixNOPQ or cytochrome cbb3, is thought to be required for respiration in endosymbiosis. FixO is a membrane bound mono-heme constituent of the fixNOPQ complex.	m
PF02434	Fringe	Fringe-like	The drosophila protein fringe (FNG) is a  glucosaminyltransferase that controls the response of the Notch receptor to specific ligands [2]. FNG is localised to the Golgi apparatus [1] (not secreted as previously thought). Modification of Notch occurs through glycosylation by FNG. The xenopus homologue, lunatic fringe, has been implicated in a variety of functions.	s
PF02435	Glyco_hydro_68	Levansucrase/Invertase	This Pfam family consists of the glycosyl hydrolase 68 family, including several bacterial levansucrase enzymes, and invertase from zymomonas.	s
PF02445	NadA	Quinolinate synthetase A protein	Quinolinate synthetase catalyses the second step of the de novo biosynthetic pathway of pyridine nucleotide formation. In particular, quinolinate synthetase is involved in the condensation of dihydroxyacetone phosphate and iminoaspartate to form quinolinic acid [2]. This synthesis requires two enzymes, a FAD-containing "B protein" and an "A protein".	y
PF02446	Glyco_hydro_77	4-alpha-glucanotransferase	These enzymes EC:2.4.1.25 transfer a segment of a (1,4)-alpha-D-glucan to a new 4-position in an acceptor, which may be glucose or (1,4)-alpha-D-glucan [1].	s
PF02450	LCAT	Lecithin:cholesterol acyltransferase	Lecithin:cholesterol acyltransferase (LCAT) is involved in extracellular metabolism of plasma lipoproteins, including cholesterol.	y
PF02458	Transferase	Transferase family	This family includes a number of transferase enzymes. These include anthranilate N-hydroxycinnamoyl/benzoyltransferase that catalyses the first committed reaction of phytoalexin biosynthesis [1]. Deacetylvindoline 4-O-acetyltransferase EC:2.3.1.107 catalyses the last step in vindoline biosynthesis is also a member of this family [2]. The motif HXXXD is probably part of the active site. The family also includes trichothecene 3-O-acetyltransferase.	y
PF02461	AMO	Ammonia monooxygenase	Ammonia monooxygenase plays a key role in the nitrogen cycle and degrades a wide range of hydrocarbons and halogenated hydrocarbons.	y
PF02485	Branch	Core-2/I-Branching enzyme	This is a family of two different beta-1,6-N-acetylglucosaminyltransferase enzymes, I-branching enzyme (eg Swiss:Q06430) and core-2 branching enzyme (eg Swiss:Q02742).  I-branching enzyme is responsible for the production of the blood group I-antigen during embryonic development [1]. Core-2 branching enzyme forms crucial side-chain branches in O-glycans [2]. This is a fmmily of glycosyl-transferases that are Type II membrane proteins that are found in the endoplasmic reticulum (ER) and Golgi apparatus [2].	s
PF02502	LacAB_rpiB	Ribose/Galactose Isomerase	This family of proteins contains the sugar isomerase enzymes ribose  5-phosphate isomerase B (rpiB), galactose isomerase subunit A (LacA) and galactose isomerase subunit B (LacB). 	y
PF02503	PP_kinase	Polyphosphate kinase middle domain	Polyphosphate kinase (Ppk) catalyses the formation of polyphosphate from ATP, with chain lengths of up to a thousand or more orthophosphate molecules.	m
PF02504	FA_synthesis	Fatty acid synthesis protein	The plsX gene is part of the bacterial fab gene cluster which encodes several key fatty acid biosynthetic enzymes [1]. The exact function of the plsX protein in fatty acid synthesis is unknown.	y
