pfam_number	Name	Description	Long_description	enzyme_annotation
PF09365	DUF2461	Conserved hypothetical protein (DUF2461)	Members of this family are widely (though sparsely) distributed bacterial proteins, about 230 residues in length. All members have a motif RxxRDxRFxxx[DN]KxxY. The function of this protein family is unknown.	u
PF09367	CpeS	CpeS-like protein	This family, that includes CpeS proteins, is functionally uncharacterised.	u
PF09409	PUB	PUB domain	The PUB (also known as PUG) domain is found in peptide N-glycanase where it functions as a AAA ATPase binding domain [1]. This domain is also found on other proteins linked to the ubiquitin-proteasome system.	y
PF09412	XendoU	Endoribonuclease XendoU	This is a family of endoribonucleases involved in RNA biosynthesis which has been named XendoU in Xenopus laevis. XendoU is a U-specific metal dependent enzyme that produces products with a 2'-3' cyclic phosphate termini.	m
PF09414	RNA_ligase	RNA ligase	This is a family of RNA ligases. The enzyme repairs RNA strand breaks in nicked DNA:RNA and RNA:RNA but not in DNA:DNA duplexes.	m
PF09416	UPF1_Zn_bind	RNA helicase (UPF2 interacting domain)	UPF1 is an essential RNA helicase that detects mRNAs containing premature stop codons and triggers their degradation.  This domain contains 3 zinc binding motifs and forms interactions with another protein (UPF2) that is also involved nonsense-mediated mRNA decay (NMD) [1].	m
PF09419	PGP_phosphatase	Mitochondrial PGP phosphatase	This is a family of proteins that acts as a mitochondrial phosphatase in cardiolipin biosynthesis. Cardiolipin is a unique dimeric phosphoglycerolipid predominantly present in mitochondrial membranes. The inverted phosphatase motif includes the highly conserved DKD triad [1].	y
PF09423	PhoD	PhoD-like phosphatase		y
PF09445	Methyltransf_15	RNA cap guanine-N2 methyltransferase	RNA cap guanine-N2 methyltransferases such as Schizosaccharomyces pombe Tgs1 and Giardia lamblia Tgs2 catalyse methylation of the exocyclic N2 amine of 7-methylguanosine [1].	m
PF09448	MmlI	Methylmuconolactone methyl-isomerase 	MmlI is a short, approx 115 residue, protein of two alpha helices and four beta strands. It is involved in the catabolism of methyl-substituted aromatics via a modified oxo-adipate pathway in bacteria. The enzyme appears to be monomeric in some species [1] and tetrameric in others [2]. The known structure shows two copies of the protein form a dimeric alpha beta barrel.	y
PF09459	EB_dh	Ethylbenzene dehydrogenase	Eythylbenzene dehydrogenase is a heterotrimer of three subunits that catalyses the anaerobic degradation of hydrocarbons. The alpha subunit contains the catalytic centre as a Molybdenum cofactor-complex. This removes an electron-pair from the hydrocarbon and passes it along an electron transport system involving iron-sulphur complexes held in the beta subunit and a Haem b molecule contained in the gamma subunit. The electron-pair is then subsequently passed to an as yet unknown receiver [1]. The enzyme is found in a variety of different bacteria.	y
PF09472	MtrF	Tetrahydromethanopterin S-methyltransferase, F subunit (MtrF)	Many archaea have evolved energy-yielding pathways marked by one-carbon biochemistry featuring novel cofactors and enzymes. This domain is mostly found in MtrF, where it covers the entire length of the protein. This polypeptide is one of eight subunits of the N5-methyltetrahydromethanopterin: coenzyme M methyltransferase complex found in methanogenic archaea. This is a membrane-associated enzyme complex that uses methyl-transfer reactions to drive a sodium-ion pump. MtrF itself is involved in the transfer of the methyl group from N5-methyltetrahydromethanopterin to coenzyme M. Subsequently, methane is produced by two-electron reduction of the methyl moiety in methyl-coenzyme M by another enzyme, methyl-coenzyme M reductase. In some organisms this domain is found at the C terminal region of what appears to be a fusion of the MtrA and MtrF proteins. The function of these proteins is unknown, though it is likely that they are involved in C1 metabolism.	y
PF09488	Osmo_MPGsynth	Mannosyl-3-phosphoglycerate synthase (osmo_MPGsynth)	This family consists of examples of mannosyl-3-phosphoglycerate synthase (MPGS), which together with mannosyl-3-phosphoglycerate phosphatase (MPGP) EC:2.4.1.217, comprises a two-step pathway for mannosylglycerate biosynthesis. Mannosylglycerate is a compatible solute that tends to be restricted to extreme thermophiles of archaea and bacteria. Note that in Rhodothermus marinus, this pathway is one of two; the other is condensation of GDP-mannose with D-glycerate by mannosylglycerate synthase.	y
PF09491	RE_AlwI	AlwI restriction endonuclease	This family includes the AlwI (recognises GGATC), Bsp6I (recognises GC^NGC) , BstNBI (recognises GASTC), PleI(recognises GAGTC) and MlyI (recognises GAGTC) restriction endonucleases.	m
PF09492	Pec_lyase	Pectic acid lyase	Members of this family are isozymes of pectate lyase (EC:4.2.2.2), also called polygalacturonic transeliminase and alpha-1,4-D-endopolygalacturonic acid lyase.	s
PF09505	Dimeth_Pyl	Dimethylamine methyltransferase (Dimeth_PyL)	This family consists of dimethylamine methyltransferases from the genus Methanosarcina. It is found in three nearly identical copies in each of Methanosarcina acetivorans, Methanosarcina barkeri, and Methanosarcina mazei. It is one of a suite of three non-homologous enzymes with a critical UAG-encoded pyrrolysine residue in these species (along with trimethylamine methyltransferase and monomethylamine methyltransferase). It demethylates dimethylamine, leaving monomethylamine, and methylates the prosthetic group of the small corrinoid protein MtbC. The methyl group is then transferred by methylcorrinoid:coenzyme M methyltransferase to coenzyme M. Note that the pyrrolysine residue is variously translated as K or X, or as a stop codon that truncates the sequence.	y
PF09506	Salt_tol_Pase	Glucosylglycerol-phosphate phosphatase (Salt_tol_Pase)	Proteins in this family are glucosylglycerol-phosphate phosphatases, with the gene symbol stpA (Salt Tolerance Protein A). A motif characteristic of acid phosphatases is found, but otherwise this family shows little sequence similarity to other phosphatases. This enzyme acts on the glucosylglycerol phosphate, product of glucosylglycerol phosphate synthase and immediate precursor of the osmoprotectant glucosylglycerol.	y
PF09508	Lact_bio_phlase	Lacto-N-biose phosphorylase N-terminal TIM barrel domain	The gene which codes for this protein in gut-bacteria is located in a novel putative operon for galactose metabolism. The protein appears to be a carbohydrate-processing phosphorolytic enzyme (EC:2.4.1.211), unlike either glycoside hydrolases or glycoside lyase. Intestinal colonisation by bifidobacteria is important for human health, especially in pediatrics, because colonisation seems to prevent infection by some pathogenic bacteria that cause diarrhoea or other illnesses. The operon seems to be involved in intestinal colonisation by bifidobacteria mediated by metabolism of mucin sugars. In addition, it may also resolve the question of the nature of the bifidus factor in human milk as the lacto-N-biose structure found in milk oligosaccharides.	s
PF09516	RE_CfrBI	CfrBI restriction endonuclease	This family includes the CfrBI (recognises and cleaves C^CWWGG) restriction endonuclease.	m
PF09518	RE_HindIII	HindIII restriction endonuclease	This family includes the HindIII (recognises and cleaves A^AGCTT) restriction endonuclease.	m
PF09519	RE_HindVP	HindVP restriction endonuclease	This family includes the HindVP (recognises GRCGYC bu the cleavage site is unknown) restriction endonucleases.	m
PF09520	RE_TdeIII	Type II restriction endonuclease, TdeIII	This family includes many TdeIII restriction endonucleases that recognise and cleave at GGNCC sites. TdeIII cleave unmethylated double-stranded DNA [1].	m
PF09522	RE_R_Pab1	R.Pab1 restriction endonuclease		m
PF09536	DUF2378	Protein of unknown function (DUF2378)	This family consists of a set of at least 17 paralogous proteins in Myxococcus xanthus DK 1622 and and 12 in Stigmatella aurantiaca DW4/3-1. Members are about 200 amino acids in length. The function is unknown.	u
PF09537	DUF2383	Domain of unknown function (DUF2383)	Members of this protein family are found mostly in the Proteobacteria, although one member is found in the the marine planctomycete Pirellula sp. strain 1. The function is unknown.	u
PF09544	DUF2381	Protein of unknown function (DUF2381)	This family consists of at least 8 paralogs in Myxococcus xanthus, a member of the Deltaproteobacteria. The function is unknown.	u
PF09549	RE_Bpu10I	Bpu10I restriction endonuclease	This family includes the Bpu10I (recognises and cleaves CCTNAGC (-5/-2)) restriction endonucleases.	m
PF09553	RE_Eco47II	Eco47II restriction endonuclease	This family includes the Eco47II (which recognises GGNCC, but the cleavage site unknown) restriction endonuclease.	m
PF09565	RE_NgoFVII	NgoFVII restriction endonuclease	This family includes the NgoFVII (recognises GCSGC but cleavage site unknown) restriction endonuclease.	m
PF09566	RE_SacI	SacI restriction endonuclease	This family includes the SacI (recognises and cleaves GAGCT^C) restriction endonuclease.	m
PF09569	RE_ScaI	ScaI restriction endonuclease	This family includes the ScaI (recognises and cleaves AGT^ACT) restriction endonuclease.	m
PF09588	YqaJ	YqaJ-like viral recombinase domain	This protein family is found in many different bacterial species but is of viral origin. The protein forms an oligomer and functions as a processive alkaline exonuclease that digests linear double-stranded DNA in a Mg(2+)-dependent reaction, It has a preference for 5'-phosphorylated DNA ends. It thus forms part of the two-component SynExo viral recombinase functional unit [1].	u
PF09594	GT87	Glycosyltransferase family 87	The enzymes in this family are glycosyltransferases. PimE is involved in phosphatidylinositol mannoside (PIM) synthesis, a major class of glycolipids in all mycobacteria. PimE is a polyprenol-phosphate-mannose-dependent mannosyltransferase that transfers the fifth mannose of PIM [1]. The family also includes alpha(1-->3) arabinofuranosyltransferase, invloved in the synthesis of of mycobacterial arabinogalactan [2].	s
PF09631	Sen15	Sen15 protein	The Sen15 subunit of the tRNA intron-splicing endonuclease is one of the two structural subunits of this hetero-tetrameric enzyme. Residues 36-157 of this subunit possess a novel homodimeric fold.  Each monomer consists of three alpha-helices and a mixed antiparallel/parallel beta-sheet. Two monomers of Sen15 fold with two monomers of Sen34, one of the two catalytic subunits, to form an alpha2-beta2 tetramer as part of the functional endonuclease assembly.	m
PF09663	Amido_AtzD_TrzD	Amidohydrolase ring-opening protein (Amido_AtzD_TrzD)	Members of this family are ring-opening amidohydrolases, including cyanuric acid amidohydrolase (CAH) (EC:3.5.2.15) (AtzD and TrzD) and barbituric acid hydrolase (BAH). Note that barbiturase does not act as defined for EC:3.5.2.1 (barbiturate + water = malonate + urea) but rather catalyses the ring opening of barbiturase acid to ureidomalonic acid. Cyanuric acid hydrolases (AtzD) and barbiturases are homologous and found almost exclusively in bacteria [1]. CAH is a homotetramer, the monomer of which possesses a fold that is dubbed the Toblerone fold. Although not obvious from the protein sequence, each CAH monomer possesses 3-fold rotational symmetry, for which the repeated structural motif is structurally similar to that of the YjgF superfamily of proteins (two alpha helices and a four-strand antiparallel beta-sheet), despite having low sequence similarity. This suggests that the Toblerone fold evolved from concatenated YjgF family proteins. The 3-fold symmetry of each CAH monomer extends to the active site, which contains three Arg-Lys-Ser triads, which bind the substrate via an extensive hydrogen bonding network [2].	y
PF09665	RE_Alw26IDE	Type II restriction endonuclease (RE_Alw26IDE)	Members of this entry are type II restriction endonucleases of the Alw26I/Eco31I/Esp3I family. Characterised specificities of the three members are GGTCTC, CGTCTC and the shared subsequence GTCTC.	m
PF09704	Cas_Cas5d	CRISPR-associated protein (Cas_Cas5)	CRISPR is a term for Clustered, Regularly Interspaced Short Palindromic Repeats. A number of protein families appear only in association with these repeats and are designated Cas (CRISPR-Associated) proteins. This small Cas family is represented by CT1134 of Chlorobium tepidum.	m
PF09707	Cas_Cas2CT1978	CRISPR-associated protein (Cas_Cas2CT1978)	This entry represents a minor branch of the Cas2 family of CRISPR-associated protein which are found in IPR003799. Cas proteins are found adjacent to a characteristic short, palindromic repeat cluster termed CRISPR, a probable mobile DNA element.	m
PF09712	PHA_synth_III_E	Poly(R)-hydroxyalkanoic acid synthase subunit (PHA_synth_III_E)	This entry represents the PhaE subunit of the heterodimeric class (class III) of polymerase for poly(R)-hydroxyalkanoic acids (PHAs), carbon and energy storage polymers of many bacteria. The most common PHA is polyhydroxybutyrate but about 150 different constituent hydroxyalkanoic acids (HAs) have been identified in various species.	y
PF09764	Nt_Gln_amidase	N-terminal glutamine amidase	This protein is conserved from plants to humans. It represents a family of N terminal glutamine amidases. The enzyme removes the NH2 group from a Gln, at the N-terminal, rendering it a Glu.	m
PF09778	Guanylate_cyc_2	Guanylylate cyclase	Members of this family of proteins catalyse the conversion of guanosine triphosphate (GTP) to 3',5'-cyclic guanosine monophosphate (cGMP) and pyrophosphate.	y
PF09827	CRISPR_Cas2	CRISPR associated protein Cas2	Members of this family of bacterial proteins comprise various hypothetical proteins, as well as CRISPR (clustered regularly interspaced short palindromic repeats) associated proteins, conferring resistance to infection by certain bacteriophages.	m
PF09842	DUF2069	Predicted membrane protein (DUF2069)	This domain, found in various prokaryotes, has no known function.	u
PF09844	DUF2071	Uncharacterized conserved protein (COG2071)	This conserved protein (similar to YgjF), found in various prokaryotes, has no known function.	u
PF09848	DUF2075	Uncharacterized conserved protein (DUF2075)	This domain, found in various prokaryotic proteins (including putative ATP/GTP binding proteins), has no known function.	u
PF09859	Oxygenase-NA	Oxygenase, catalysing oxidative methylation of damaged DNA	This family of bacterial sequences is predicted to catalyse oxidative de-methylation of damaged bases in DNA.	y
PF09860	DUF2087	Uncharacterized protein conserved in bacteria (DUF2087)	This domain, found in various hypothetical prokaryotic proteins and transcriptional activators, has no known function. Structural modelling suggests this domain may bind nucleic acids [1].	u
PF09861	Lar_N	Lactate racemase N-terminal domain	This is the N-terminal domain found in Lactate racemase enzymes EC:5.1.2.1. LarA is a nickel-dependent lactate racemase from the larA-E operon of Lactobacillus plantarum, whereas LarB, LarC and LarE are accessory proteins required for the incorporation of Ni in the lactate racemase apoprotein. LarA contains 18 beta-strands and 16 alpha-helices arranged in a novel fold composed of two domains of similar size. This entry represents the N-terminal domain of LarA and related proteins [1].	u
PF09910	DUF2139	Uncharacterized protein conserved in archaea (DUF2139)	This domain, found in various hypothetical archaeal proteins, has no known function.	u
PF09948	DUF2182	Predicted metal-binding integral membrane protein (DUF2182)	This domain, found in various hypothetical bacterial membrane proteins having predicted metal-binding properties, has no known function.	u
PF09954	DUF2188	Uncharacterized protein conserved in bacteria (DUF2188)	This domain, found in various hypothetical bacterial proteins, has no known function.	u
PF09981	DUF2218	Uncharacterized protein conserved in bacteria (DUF2218)	This domain, found in various hypothetical bacterial proteins, has no known function.	u
PF09983	DUF2220	Uncharacterized protein conserved in bacteria C-term(DUF2220)	This domain, found in various hypothetical bacterial proteins, has no known function. The family represents just the C-terminus.	y
PF09990	DUF2231	Predicted membrane protein (DUF2231)	This domain, found in various hypothetical bacterial proteins, has no known function.	u
PF09992	NAGPA	Phosphodiester glycosidase	This is a family conserved from bacteria to humans. The structure of a member from Bacteroides has been crystallised and modelled onto the luminal region of the human member of the family, the transmembrane glycoprotein N-acetylglucosamine-1-phosphodiester alpha-N-acetylglucosaminidase. There is some conservation of potentially functional residues, implying that in the bacterial members this family acts in some way as a phosphodiester glycosidase [1]. The human protein is also present, so the eukaryotic members are likely to be catalysing the second step in the formation of the mannose 6-phosphate targeting signal on lysosomal enzyme oligosaccharides [2].	y
PF09995	DUF2236	Uncharacterized protein conserved in bacteria (DUF2236)	This domain, found in various hypothetical bacterial proteins, has no known function. This family contains a highly conserved arginine and histidine that may be active site residues for an as yet unknown catalytic activity.	u
PF09998	DUF2239	Uncharacterized protein conserved in bacteria (DUF2239)	This domain, found in various hypothetical bacterial proteins, has no known function.	u
PF10002	DUF2243	Predicted membrane protein (DUF2243)	This domain, found in various hypothetical bacterial proteins, has no known function.	u
PF10009	DUF2252	Uncharacterized protein conserved in bacteria (DUF2252)	This domain, found in various hypothetical bacterial proteins, has no known function.	u
PF10014	2OG-Fe_Oxy_2	2OG-Fe dioxygenase	This family contains 2-oxoglutarate (2OG) and Fe-dependent dioxygenases. It includes L-isoleucine dioxygenase (IDO) [1,2].	y
PF10021	DUF2263	Uncharacterized protein conserved in bacteria (DUF2263)	This domain, found in various hypothetical bacterial and eukaryotic proteins, has no known function.	u
PF10022	DUF2264	Uncharacterized protein conserved in bacteria (DUF2264)	Members of this family of hypothetical bacterial proteins have no known function.	u
PF10027	DUF2269	Predicted integral membrane protein (DUF2269)	Members of this family of bacterial hypothetical integral membrane proteins have no known function.	u
PF10042	DUF2278	Uncharacterized conserved protein (DUF2278)	Members of this family of hypothetical bacterial proteins have no known function.	u
PF10049	DUF2283	Protein of unknown function (DUF2283)	Members of this family of hypothetical bacterial proteins have no known function.	u
PF10053	DUF2290	Uncharacterized conserved protein (DUF2290)	Members of this family of hypothetical bacterial proteins have no known function.	u
PF10067	DUF2306	Predicted membrane protein (DUF2306)	Members of this family of hypothetical bacterial proteins have no known function.	u
PF10070	DUF2309	Uncharacterized protein conserved in bacteria (DUF2309)	Members of this family of hypothetical bacterial proteins have no known function.	u
PF10096	DUF2334	Uncharacterized protein conserved in bacteria (DUF2334)	This domain, found in various hypothetical bacterial proteins, has no known function.	u
PF10100	Staph_opine_DH	Staphylopine dehydrogenase	A member of this family has been identified in Staphylococcus aureus as a dehydrogenase involved in the synthesis of a new metallophore,named staphylopine. It is encoded as part of an operon that also includes an histidine racemase and an enzyme distantly related to nicotianamine synthase [1]. Staphylopine is involved in metal acquisition, chelating nickel, cobalt, zinc, copper or iron, depending on the growing conditions. Metal acquisition is vital for bacteria growing in metal-scarce environments, such as inside a host in the case of pathogens.	y
PF10111	Glyco_tranf_2_2	Glycosyltransferase like family 2	Members of this family of prokaryotic proteins include putative glucosyltransferase, which are involved in bacterial capsule biosynthesis [1][2].	s
PF10118	Metal_hydrol	Predicted metal-dependent hydrolase	Members of this family of proteins comprise various bacterial transition metal-dependent hydrolases.	y
PF10128	OpcA_G6PD_assem	Glucose-6-phosphate dehydrogenase subunit	Members of this family are found in various prokaryotic OpcA and glucose-6-phosphate dehydrogenase proteins. The exact function of the domain is, as yet, unknown.	y
PF10129	OpgC_C	OpgC protein	This domain, found in various hypothetical and OpgC prokaryotic proteins. It is likely to act as an acyltransferase enzyme.	y
PF10150	RNase_E_G	Ribonuclease E/G family	Ribonuclease E and Ribonuclease G are related enzymes that cleave a wide variety of RNAs [1].	m
PF10162	G8	G8 domain	This domain is found in disease proteins PKHD1 and KIAA1199 and is named G8 after its 8 conserved glycines. It is predicted to contain 10 beta strands and an alpha helix.	u
PF10181	PIG-H	GPI-GlcNAc transferase complex, PIG-H component	PIG-H is a family of conserved proteins that complexes with three other proteins to form the GPI-GnT (glycosylphosphatidylinositol anchor biosynthesis transferase) complex. It appears to be a peripheral membrane protein facing the cytoplasm involved in the first step in GPI anchor formation.	y
PF10198	Ada3	Histone acetyltransferases subunit 3	Ada3 is a family of proteins conserved from yeasts to humans [1]. It is an essential component of the Ada transcriptional coactivator (alteration/deficiency in activation) complex. Ada3 plays a key role in linking histone acetyltransferase-containing complexes to p53 (tumour suppressor protein) thereby regulating p53 acetylation, stability and transcriptional activation following DNA damage [2].	m
PF10215	Ost4	Oligosaccaryltransferase  	Ost4 is a very short, approximately 30 residues, enzyme found from fungi to vertebrates. It is a member of the ER oligosaccaryltansferase complex, EC 2.4.1.119, that catalyses the asparagine-linked glycosylation of proteins. It appears to be an integral membrane protein that mediates the en bloc transfer of a preassembled high-mannose oligosaccharide onto asparagine residues of nascent polypeptides as they enter the lumen of the rough endoplasmic reticulum (RER).	s
PF10250	O-FucT	GDP-fucose protein O-fucosyltransferase	This is a family of conserved proteins representing the enzyme responsible for adding O-fucose to EGF (epidermal growth factor-like) repeats. Six highly conserved cysteines are present in O-FucT-1 as well as a DXD-like motif (ERD), conserved in mammals, Drosophila, and C. elegans. Both features are characteristic of several glycosyltransferase families. The enzyme is a membrane-bound protein released by proteolysis and, as for most glycosyltransferases, is strongly activated by manganese [1].	s
PF10282	Lactonase	Lactonase, 7-bladed beta-propeller	This entry contains bacterial 6-phosphogluconolactonases (6PGL)YbhE-type (EC:3.1.1.31) which hydrolyse 6-phosphogluconolactone to 6-phosphogluconate. The entry also contains the fungal muconate lactonising enzyme carboxy-cis,cis-muconate cyclase (EC:5.5.1.5) and muconate cycloisomerase (EC:5.5.1.1), which convert cis,cis-muconates to muconolactones and vice versa as part of the microbial beta-ketoadipate pathway.                          Structures of proteins in this family have revealed a 7-bladed beta-propeller fold [1].	y
PF10285	Luciferase_cat	Luciferase catalytic domain	This domain is the catalytic domain of dinoflagellate luciferase . Luciferase is involved in catalysing the light emitting reaction in bioluminescence. The structure of this domain has been solved [1]. The core part of the domain is a 10 stranded beta barrel that is structurally similar to lipocalins and FABP [1].	y
PF10288	CTU2	Cytoplasmic tRNA 2-thiolation protein 2	CTU2 is a family of proteins necessary for the formation of the wobble nucleoside 5-methoxycarbonylmethyl-2-thiouridine in Saccharomyces cerevisiae. The family is conserved from plants to humans ]1]. It plays a central role in the 2-thiolation of 5-methoxycarbonylmethyl-2-thiouridine, or the wobble nucleoside [2]. This wobble modification in tRNAs, 5-methoxycarbonylmethyl-2-thiouridine (mcm(5)s(2)U), is required for the proper decoding of NNR codons in eukaryotes. The 2-thio group gives rigidity by largely fixing the C3'-endo ribose puckering, ensuring stable and accurate codon-anticodon pairing [3].	y
PF10294	Methyltransf_16	Lysine methyltransferase	Methyltrans_16 is a lysine methyltransferase. Characterised members of this family are protein methyltransferases targetting Lys residues in specific proteins, including calmodulin, VCP, Kin17 and Hsp70 proteins [2,3,4,5].	y
PF10343	Q_salvage	Potential Queuosine, Q, salvage protein family	Q_salvage proteins occur in most Eukarya as well as in a few bacteria possible via horizontal gene-transfer. Queuosine (Q) is a chemical modification found at the wobble position of tRNAs that have GUN anticodons. Most bacteria synthesize queuosine de novo, whereas eukaryotes rely solely on salvaging this essential component from the environment or the gut flora. The exact enzymatic function of the domain has yet to be determined, but structural similarity with DNA glycosidases suggests a ribonucleoside hydrolase role [1].	y
PF10354	DUF2431	Domain of unknown function (DUF2431)	This is the N-terminal domain of a family of proteins found from plants to humans. The function is not known.	u
