pfam_number	Name	Description	Long_description	enzyme_annotation
PF04262	Glu_cys_ligase	Glutamate-cysteine ligase 	Family of bacterial f glutamate-cysteine ligases (EC:6.3.2.2) that carry out the first step of the glutathione biosynthesis pathway.	y
PF04263	TPK_catalytic	Thiamin pyrophosphokinase, catalytic domain	Family of thiamin pyrophosphokinase (EC:2.7.6.2). Thiamin pyrophosphokinase (TPK) catalyses the transfer of a pyrophosphate group from ATP to vitamin B1 (thiamin) to form the coenzyme thiamin pyrophosphate (TPP). Thus, TPK is important for the formation of a coenzyme required for central metabolic functions. The structure of thiamin pyrophosphokinase suggest that the enzyme may operate by a mechanism of pyrophosphoryl transfer similar to those described for pyrophosphokinases functioning in nucleotide biosynthesis [1].	y
PF04264	YceI	YceI-like domain	E. coli YceI is a base-induced periplasmic protein [1]. The recent structure of a member of this family shows that it binds to poly-isoprenoid [2]. The structure consists of an extended, eight-stranded, antiparallel beta-barrel that resembles the lipocalin fold.	u
PF04267	SoxD	Sarcosine oxidase, delta subunit family 	Sarcosine oxidase is a hetero-tetrameric enzyme that contains both covalently bound FMN and non-covalently bound FAD and NAD(+).  This enzyme catalyses the oxidative demethylation of sarcosine to yield glycine, H2O2, and 5,10-CH2-tetrahydrofolate (H4folate) in a reaction requiring H4folate and O2 [1,2].	y
PF04268	SoxG	Sarcosine oxidase, gamma subunit family 	Sarcosine oxidase is a hetero-tetrameric enzyme that contains both covalently bound FMN and non-covalently bound FAD and NAD(+).  This enzyme catalyses the oxidative demethylation of sarcosine to yield glycine, H2O2, and 5,10-CH2-tetrahydrofolate (H4folate) in a reaction requiring H4folate and O2 [1,2].	y
PF04275	P-mevalo_kinase	Phosphomevalonate kinase 	Phosphomevalonate kinase (EC:2.7.4.2) catalyses the  phosphorylation of 5-phosphomevalonate into 5-diphosphomevalonate,  an essential step in isoprenoid biosynthesis via the mevalonate  pathway [1]. This family represents the animal type of the  enzyme. The other is the ERG8 type, found in plants and fungi, and some bacteria (see Pfam:PF00288).	y
PF04277	OAD_gamma	Oxaloacetate decarboxylase, gamma chain 		y
PF04286	DUF445	Protein of unknown function (DUF445)	Predicted to be a membrane protein.	u
PF04295	GD_AH_C	D-galactarate dehydratase / Altronate hydrolase, C terminus	Family members include the C termini of D-galactarate dehydratase  (EC:4.2.1.42) which is thought to catalyse the reaction  D-galactarate = 5-keto-4-deoxy-D-glucarate + H2O, [1] and altronate  hydrolase (altronic acid hydratase, EC:4.2.1.7), which catalyses D-altronate = 2-keto-2-deoxygluconate + H2O [2]. As purified, both enzymes are catalytically inactive in the absence of  added Fe2+, Mn2+, and beta-mercaptoethanol.  Synergistic activation of altronate hydrolase activity is seen in the presence of both iron and manganese ions, suggesting that the enzyme may have two ion binding sites. Mn2+ appears to be part of the enzyme active centre, but the function of  the single bound Fe2+ ion is unknown.  The hydratase has no Fe-S core [3].	y
PF04299	FMN_bind_2	Putative FMN-binding domain	In Bacillus subtilis, family member Swiss:P21341 (PAI 2/ORF-2) was found to be essential for growth [1]. The SUPERFAMILY database finds that this domain is related to FMN-binding domains, suggesting this protein is also FMN-binding.	u
PF04303	PrpF	PrpF protein	PrpF is a protein found in the 2-methylcitrate pathway. It is structurally similar to DAP epimerase and proline racemase. This protein is likely to acts to isomerise trans-aconitate to cis-aconitate [1].	y
PF04304	DUF454	Protein of unknown function (DUF454)	Predicted membrane protein.	u
PF04307	YdjM	LexA-binding, inner membrane-associated putative hydrolase	YdjM is a family of putative LexA-binding proteins. Members are predicted to be membrane-bound metal-dependent hydrolases that may be acting as phospholipases. It is a member of the SOS network, that rescues cells from UV and other DNA-damage. Expression of YdjM is regulated by LexA [1].	u
PF04320	DUF469	Protein with unknown function (DUF469)	Family of bacteria protein with no known function.	u
PF04321	RmlD_sub_bind	RmlD substrate binding domain	L-rhamnose is a saccharide required for the virulence of some bacteria. Its precursor, dTDP-L-rhamnose, is synthesised by four different enzymes the final one of which is RmlD.                             The RmlD substrate binding domain is responsible for binding a sugar nucleotide [1,2].	y
PF04325	DUF465	Protein of unknown function (DUF465)	Family members are found in small bacterial proteins, and also in the heavy chains of eukaryotic myosin and kinesin, C terminal of the motor domain (Myosin Pfam:PF00063, Kinesin Pfam:PF00225). Members of this family may form coiled coil structures.	u
PF04332	DUF475	Protein of unknown function (DUF475)	Predicted to be an integral membrane protein with multiple membrane spans.	u
PF04339	FemAB_like	Peptidogalycan biosysnthesis/recognition	FemAB_like is a family of both baterial and Viridiplantae proteins with responsibility for building interpeptide bridges in peptidoglycan. Such a function is feasible for bacteria but less likely for the plant members of this family. Perhaps the plant-members are using homologous proteins to recognise bacterial peptidoglcans as part of their innate immune system [1].	s
PF04341	DUF485	Protein of unknown function, DUF485	This family includes several putative integral membrane proteins.	u
PF04343	DUF488	Protein of unknown function, DUF488	This family includes several proteins of uncharacterised function.	u
PF04345	Chor_lyase	Chorismate lyase	Chorismate lyase catalyses the first step in ubiquinone synthesis, i.e. the removal of pyruvate from chorismate, to yield 4-hydroxybenzoate.	y
PF04346	EutH	Ethanolamine utilisation protein, EutH	EutH is a bacterial membrane protein whose molecular function is unknown. It has been suggested that it may act as an ethanolamine transporter, responsible for carrying ethanolamine from the periplasm to the cytoplasm [1].	y
PF04349	MdoG	Periplasmic glucan biosynthesis protein, MdoG	This family represents MdoG, a protein that is necessary for the synthesis of periplasmic glucans. The function of MdoG remains unknown. It has been suggested that it may catalyse the addition of branches to a linear glucan backbone.	s
PF04358	DsrC	DsrC like protein	Family member Swiss:P45573 has been observed to co-purify with  Desulfovibrio vulgaris dissimilatory sulfite reductase [1], and many  members of this family are annotated as the third (gamma) subunit of  dissimilatory sulphite reductase. However, this protein appears to be only loosely associated to the  sulfite reductase, which suggests that DsrC may not be an integral part of the dissimilatory sulphite reductase.  Members of this family are found in organisms such as E. coli and H. influenzae which do not contain  dissimilatory sulphite reductases but can synthesise assimilatory sirohaem  sulphite and nitrite reductases.  It is speculated that DsrC may be  involved in the assembly, folding or stabilisation of sirohaem proteins [2].  The strictly conserved cysteine in the C terminus suggests that DsrC may have a catalytic function in the metabolism of sulphur compounds [3].	y
PF04363	DUF496	Protein of unknown function (DUF496)		u
PF04365	BrnT_toxin	Ribonuclease toxin, BrnT, of type II toxin-antitoxin system	BrnT is a ribonuclease toxin of a type II toxin-antitoxin system that exhibits a RelE-like fold. The antitoxin that neutralises this toxin is Pfam:PF14384. BrnT is found in bacteria, archaea, bacteriophage, and plasmids. BrnT-BrnA forms a 2:2 tetrameric complex and autoregulates its own expression, which is induced by a number of different environmental stresses. Expression of BrnT alone results in cessation of bacterial growth which can be rescued after subsequent expression of BrnA [1].	m
PF04371	PAD_porph	Porphyromonas-type peptidyl-arginine deiminase	Peptidyl-arginine deiminase (PAD) enzymes catalyse the deimination of the guanidino group from carboxy-terminal arginine residues of various peptides to produce ammonia.  PAD from Porphyromonas gingivalis (PPAD) appears to be evolutionarily unrelated to mammalian PAD (Pfam:PF03068), which is a metalloenzyme.  PPAD is thought to belong to the same superfamily as aminotransferase and arginine deiminase, and to form an alpha/beta propeller structure. This family has previously been named PPADH (Porphyromonas peptidyl-arginine deiminase homologues) [1]. The predicted catalytic residues in PPAD (Swiss:Q9RQJ2) are Asp130, Asp187, His236, Asp238 and Cys351 [1]. These are absolutely conserved with the exception of Asp187 which is absent in two family members.  PPAD is also able to catalyse the deimination of free L-arginine, but has primarily peptidyl-arginine specificity.  It may have a FMN cofactor [2].	y
PF04376	ATE_N	Arginine-tRNA-protein transferase, N terminus	This family represents the N terminal region of the enzyme  arginine-tRNA-protein transferase (EC 2.3.2.8), which catalyses the post-translational conjugation of arginine to the N terminus of a protein. In eukaryotes, this functions as part of the N-end rule pathway  of protein degradation by conjugating a de-stabilising amino acid to the amino terminal aspartate or glutamate of a protein, targeting the protein for ubiquitin-dependent proteolysis.  N terminal cysteine is sometimes  modified [1]. In S cerevisiae, Cys20, 23, 94 and/or 95 are thought to be important  for activity [2].  Of these, only Cys 94 appears to be completely conserved in this family.	y
PF04378	RsmJ	Ribosomal RNA large subunit methyltransferase D, RlmJ	RlmJ is ribosomal RNA large subunit methyltransferase J is required for full methylation of 23S ribosomal RNA (rRNA) during ribosome biogenesis. The ribosomal RNA of E. coli carries 24 residues that require methylation, and this methyltransferase is the last to be described, that modifies A2030 [1]. RlmJ displays a variant of the Rossmann-like methyltransferase (MTase) fold with an inserted helical subdomain. On binding cofactor and substrate a large shift of the N-terminal motif X tail is induced in order to make it cover the cofactor-binding site and to trigger active-site changes in motifs IV and VIII [2].	y
PF04387	PTPLA	Protein tyrosine phosphatase-like protein, PTPLA	This family includes the mammalian protein tyrosine phosphatase-like protein, PTPLA. A significant variation of PTPLA from other protein tyrosine phosphatases is the presence of proline instead of catalytic arginine at the active site. It is thought that PTPLA proteins have a role in the development, differentiation, and maintenance of a number of tissue types [1].	m
PF04389	Peptidase_M28	Peptidase family M28		m
PF04402	SIMPL	Protein of unknown function (DUF541)	Members of this family have so far been found in bacteria and mouse SwissProt or TrEMBL entries.  However possible family members have also been identified in translated rat (Genbank:AW144450) and human (Genbank:AI478629) ESTs. A mouse family member has been named SIMPL (signalling molecule that associates with mouse pelle-like kinase).  SIMPL appears to facilitate and/or regulate complex formation between IRAK/mPLK (IL-1 receptor-associated kinase) and IKK (inhibitor of kappa-B kinase) containing complexes, and thus regulate NF-kappa-B activity [1]. Separate experiments demonstrate that a mouse family member (named LaXp180) binds the Listeria monocytogenes surface protein ActA, which is a virulence factor that induces actin polymerisation. It may also bind stathmin, a protein involved in signal transduction and in the regulation of microtubule dynamics [2]. In bacteria its function is unknown, but it is thought to be located in the periplasm or outer membrane.	u
PF04406	TP6A_N	Type IIB DNA topoisomerase	Type II DNA topoisomerases are ubiquitous enzymes that catalyse the ATP-dependent transport of one DNA duplex through a second DNA segment via a transient double-strand break.  Type II DNA topoisomerases are now subdivided into two sub-families, type IIA and IIB DNA topoisomerases.  TP6A_N is present in type IIB topoisomerase and is thought to be involved in DNA binding owing to its sequence similarity to E. coli catabolite activator protein (CAP) [1]. 	m
PF04412	DUF521	Protein of unknown function (DUF521)	Family of hypothetical proteins.	u
PF04413	Glycos_transf_N	3-Deoxy-D-manno-octulosonic-acid transferase (kdotransferase)	Members of this family transfer activated sugars to a variety of substrates, including glycogen, fructose-6-phosphate and lipopolysaccharides.  Members of the family transfer UDP, ADP, GDP or CMP linked sugars.  The Glycos_transf_N region is flanked at the N-terminus by a signal peptide and at the C-terminus by Glycos_transf_1 (Pfam:PF00534).  The eukaryotic  glycogen synthases may be distant members of this bacterial  family [1].	s
PF04414	tRNA_deacylase	D-aminoacyl-tRNA deacylase	Several aminoacyl-tRNA synthetases have the ability to transfer the D-isomer of their amino acid onto their cognate tRNA. D-aminoacyl-tRNA deacylases hydrolyse the ester bond between the polynucleotide and the D-amino acid, thereby preventing the accumulation of such mis-acylated and metabolically inactive tRNA molecules.	y
PF04417	DUF501	Protein of unknown function (DUF501)	Family of uncharacterised bacterial proteins.	u
PF04419	4F5	4F5 protein family	Members of this family are short proteins that are rich in aspartate, glutamate, lysine and arginine. Although the function of these proteins is unknown, they are found to be ubiquitously expressed [1].	y
PF04422	FrhB_FdhB_N	Coenzyme F420 hydrogenase/dehydrogenase, beta subunit N-term	Coenzyme F420 hydrogenase (EC:1.12.99.1) reduces the low-potential two-electron acceptor coenzyme F420.  This family contains the N termini of F420 hydrogenase and dehydrogenase beta subunits [1], [2].  The N terminus of Methanobacterium formicicum formate dehydrogenase beta chain (EC:1.2.1.2, Swiss:P06130) is also a member of this family [3]. This region is often found in association with the 4Fe-4S binding domain, fer4 (Pfam:PF00037).	y
PF04428	Choline_kin_N	Choline kinase N terminus	Found N terminal to choline/ethanolamine kinase regions (Pfam:PF01633) in some plant and fungal choline kinase enzymes (EC:2.7.1.32).  This region is only found in some members of the choline kinase family, and is therefore unlikely to contribute to catalysis.	y
PF04439	Adenyl_transf	Streptomycin adenylyltransferase	Also known as Aminoglycoside 6- adenylyltransferase (EC:2.7.7.-), this protein confers resistance to aminoglycoside antibiotics.	y
PF04443	LuxE	Acyl-protein synthetase, LuxE	LuxE is an acyl-protein synthetase found in bioluminescent bacteria.  LuxE catalyses the formation of an acyl-protein thioester from a fatty acid and a protein.                    This is the second step in the bioluminescent fatty acid reduction system, which converts tetradecanoic acid to the aldehyde substrate of the luciferase-catalysed bioluminescence reaction [1] A conserved cysteine found at position 364 in Photobacterium phosphoreum LuxE (Swiss:Q52100) is thought to be acylated during the transfer of the acyl group from the synthetase subunit to the reductase.  The carboxyl terminal of the synthetase is though to act as a flexible arm to transfer acyl groups between the sites of activation and reduction [2]. This family also includes Vibrio cholerae RBFN protein (Swiss:Q06961), which is involved in the biosynthesis of the O-antigen component 3-deoxy-L-glycero-tetronic acid.	y
PF04445	SAM_MT	Putative SAM-dependent methyltransferase	This is a family of putative SAM-dependent methyltransferases.	y
PF04446	Thg1	tRNAHis guanylyltransferase	The Thg1 protein from Saccharomyces cerevisiae is responsible for adding a GMP residue to the 5' end of tRNA His [1]. The catalytic domain Thg1 contains a RRM (ferredoxin) fold palm domain, just like the viral RNA-dependent RNA polymerases, reverse transcriptases, family A and B DNA polymerases, adenylyl cyclases,  diguanylate cyclases (GGDEF domain) and the predicted polymerase of the CRISPR system [2]. Thg1 possesses an active site with three  acidic residues that chelate Mg++ cations [2]. Thg1 catalyzes  polymerization similar to the 5'-3' polymerases [2][3].	y
PF04452	Methyltrans_RNA	RNA methyltransferase	RNA methyltransferases modify nucleotides during ribosomal RNA maturation in a site-specific manner.  The Escherichia coli member is specific for U1498 methylation [1][2].	m
PF04471	Mrr_cat	Restriction endonuclease	Prokaryotic family found in type II restriction enzymes containing the hallmark (D/E)-(D/E)XK active site. Presence of catalytic residues implicates this region in the enzymatic cleavage of DNA [1,2].	m
PF04476	4HFCP_synth	4-HFC-P synthase	(5-formylfuran-3-yl)methyl phosphate synthase, also known as 4-HFC-P synthase, is involved in the production of methanofuran [1,2]. This family has a classical TIM-barrel structure whose biological unit is a homohexamer [1].	y
PF04479	RTA1	RTA1 like protein	This family is comprised of fungal proteins with multiple transmembrane regions.  RTA1 (Swiss:P53047) is involved in resistance to 7-aminocholesterol [1], while RTM1 (Swiss:P40113) confers resistance to an an unknown toxic chemical in molasses [2].  These proteins may bind to the toxic substance, and thus prevent toxicity.  They are not thought to be involved in the efflux of xenobiotics [1].	u
PF04480	DUF559	Protein of unknown function (DUF559)		u
PF04507	DUF576	Csa1 family	This family contains several uncharacterised staphylococcal proteins. These proteins have been called conserved staphylococcal antigens (Csa) [1]. 	u
PF04536	TPM_phosphatase	TPM domain	This family was first named TPM domain after its founding proteins: TLP18.3, Psb32 and MOLO-1. In Arabidopsis, this domain is called the thylakoid acid phosphatase -TAP - domain and has a Rossmann-like fold [1]. In plants, the family resides in the thylakoid lumen attached to the outer membrane of the chloroplast/plastid. It is active in the photosystem II [2,3].	y
PF04551	GcpE	GcpE protein	In a variety of organisms, including plants and several eubacteria, isoprenoids are synthesised by the mevalonate-independent 2-C-methyl-D-erythritol 4-phosphate (MEP) pathway. Although different enzymes of this pathway have been described, the terminal biosynthetic steps of the MEP pathway have not been fully elucidated. GcpE gene of Escherichia coli is involved in this pathway [2].	y
PF04555	XhoI	Restriction endonuclease XhoI	This family consists of type II restriction enzymes (EC:3.1.21.4) that recognise the double-stranded sequence CTCGAG and cleave after C-1.	m
PF04572	Gb3_synth	Alpha 1,4-glycosyltransferase conserved region	The glycosphingolipids (GSL) form part of eukaryotic cell membranes. They consist of a hydrophilic carbohydrate moiety linked to a hydrophobic ceramide tail embedded within the lipid bilayer of the membrane. Lactosylceramide, Gal1,4Glc1Cer (LacCer), is the common synthetic precursor to the majority of GSL found in vertebrates. Alpha 1.4-glycosyltransferases utilise UDP donors and transfer the sugar to a beta-linked acceptor. This region appears to be confined to higher eukaryotes. No function has been yet assigned to this region [1].  	y
PF04577	DUF563	Protein of unknown function (DUF563)	Family of uncharacterised proteins.	u
PF04587	ADP_PFK_GK	ADP-specific Phosphofructokinase/Glucokinase conserved region	In archaea a novel type of glycolytic pathway exists that is deviant from the classical Embden-Meyerhof pathway. This pathway utilises two novel proteins: an ADP-dependent Glucokinase and an ADP-dependent Phosphofructokinase.  This conserved region is present at the C-terminal of both these proteins.  Interestingly this family contains sequences from higher eukaryotes. [1,2,3]. 	y
PF04607	RelA_SpoT	Region found in RelA / SpoT proteins	This region of unknown function is found in RelA and SpoT of Escherichia coli, and their homologues in plants and in other eubacteria. RelA is a guanosine 3',5'-bis-pyrophosphate (ppGpp) synthetase (EC:2.7.6.5) while SpoT is thought to be a bifunctional enzyme catalysing both ppGpp  synthesis and degradation (ppGpp 3'-pyrophosphohydrolase, (EC:3.1.7.2)) [1]. This region is often found in association with HD (Pfam:PF01966), a  metal-dependent phosphohydrolase, TGS (Pfam:PF02824) which is a possible  nucleotide-binding region, and the ACT regulatory domain (Pfam:PF01842).	m
PF04608	PgpA	Phosphatidylglycerophosphatase A	This family represents a family of bacterial phosphatidylglycerophosphatases (EC:3.1.3.27), known as PgpA. It appears that bacteria possess several phosphatidylglycerophosphatases, and thus, PgpA is not essential in Escherichia coli [1].	y
PF04613	LpxD	UDP-3-O-[3-hydroxymyristoyl] glucosamine N-acyltransferase, LpxD  	UDP-3-O-[3-hydroxymyristoyl] glucosamine N-acyltransferase (EC 2.3.1.-) catalyses an early step in lipid A biosynthesis: UDP-3-O-(3-hydroxytetradecanoyl)glucosamine + (R)-3-hydroxytetradecanoyl- [acyl carrier protein] -> UDP-2,3-bis(3-hydroxytetradecanoyl)glucosamine + [acyl carrier protein] [1]. Members of this family also contain a hexapeptide repeat (Pfam:PF00132).  This family constitutes the non-repeating region of LPXD proteins.	y
PF04616	Glyco_hydro_43	Glycosyl hydrolases family 43	The glycosyl hydrolase family 43 contains members that are arabinanases. Arabinanases hydrolyse the alpha-1,5-linked  L-arabinofuranoside backbone of plant cell wall arabinans.  The structure of arabinanase Arb43A from Cellvibrio japonicus reveals a five-bladed beta-propeller fold. A long V-shaped  groove, partially enclosed at one end, forms a single extended  substrate-binding surface across the face of the propeller [1].	s
PF04655	APH_6_hur	Aminoglycoside/hydroxyurea antibiotic resistance kinase	The aminoglycoside phosphotransferases achieve inactivation of their antibiotic substrates by phosphorylation utilising ATP. Likewise hydroxyurea is inactivated by phosphorylation of the hydroxy group in the hydroxylamine moiety [1,2,3].	y
PF04663	Phenol_monoox	Phenol hydroxylase conserved region	Under aerobic conditions, phenol is usually hydroxylated to catechol and degraded via the meta or ortho pathways. Two types of phenol hydroxylase are known: one is a multi-component enzyme the other is a single-component monooxygenase.  This region is found in both types of enzymes [1,2].	y
PF04673	Cyclase_polyket	Polyketide synthesis cyclase	This family represents a number of cyclases involved in polyketide synthesis in a number of actinobacterial species.	y
PF04710	Pellino	Pellino	Pellino is involved in Toll-like signalling pathways, and associates with the kinase domain of the Pelle Ser/Thr kinase [1,2,3].	m
PF04715	Anth_synt_I_N	Anthranilate synthase component I, N terminal region	Anthranilate synthase (EC:4.1.3.27) catalyses the first step in the  biosynthesis of tryptophan.  Component I catalyses the formation of  anthranilate using ammonia and chorismate.  The catalytic site lies in the adjacent region, described in the chorismate binding enzyme family  (Pfam:PF00425). This region is involved in feedback inhibition by tryptophan [1].  This family also contains a region of Para-aminobenzoate synthase component I (EC 4.1.3.-).	y
PF04723	GRDA	Glycine reductase complex selenoprotein A	Found in clostridia, this protein contains one active site selenocysteine and catalyses the reductive deamination of glycine, which is coupled to the esterification of orthophosphate resulting in the formation of ATP [1]. A member of this family may also exist in Treponema denticola [2].	y
PF04724	Glyco_transf_17	Glycosyltransferase family 17	This family represents beta-1,4-mannosyl-glycoprotein beta-1,4-N-acetylglucosaminyltransferase (EC:2.4.1.144). This enzyme transfers the bisecting GlcNAc to the core mannose of complex N-glycans. The addition of this residue is regulated during development and has functional consequences for receptor signalling, cell adhesion, and tumour progression [1,2].	s
PF04734	Ceramidase_alk	Neutral/alkaline non-lysosomal ceramidase, N-terminal	This family represents N-terminal domain of a group of neutral/alkaline ceramidases found in both bacteria and eukaryotes [1,2,3]. The EC classification is EC:3.5.1.23.  The enzyme hydrolyses ceramide to generate sphingosine and fatty acid. The enzyme plays a regulatory role in a variety of physiological events in eukaryotes and also functions as an exotoxin in particular bacteria. This N-terminal domain carries two metal-binding sites, the first for Zn2+ residing within the domain, and the second, for Mg2+/Ca2+ lying at the interface between the two domains [4].	y
PF04744	Monooxygenase_B	Monooxygenase subunit B protein	Family of membrane associated monooxygenases (EC 1.13.12.-) which utilise O(2) to oxidise their substrate.  Family members include both ammonia and methane monooxygenases involved in the oxidation of their respective substrates.  These enzymes are multi-subunit  complexes.  This family represents the B subunit of the enzyme; the A subunit is thought to contain the active site. [1,2]. 	y
PF04752	ChaC	ChaC-like protein	The ChaC family of proteins function as gamma-glutamyl cyclotransferases acting specifically to degrade glutathione but not other gamma-glutamyl peptides [1, 2]. It is is conversed across all phyla and represents a new pathway for glutathione degradation in living cells.	y
PF04762	IKI3	IKI3 family	Members of this family are components of the elongator multi-subunit component of a novel RNA polymerase II holoenzyme for transcriptional elongation [1]. This region contains WD40 like repeats.	m
